1Ki 1:	<b>Overview</b><br><u>1Ki_1:1</u>, Abishag cherishes David in his extreme age; <br><u>1Ki_1:5</u>, Adonijah, David's darling, usurps the kingdom; <br><u>1Ki_1:11</u>, By the council of Nathan, <br><u>1Ki_1:15</u>, Bath-sheba moves the king, <br><u>1Ki_1:22</u>, and Nathan seconds her; <br><u>1Ki_1:28</u>, David renews his oath to Bath-sheba; <br><u>1Ki_1:32</u>, Solomon, by David's appointment, being anointed king by Zadok and Nathan, the people triumph; <br><u>1Ki_1:41</u>, Jonathan bringing the news, Adonijah's guests fly; <br><u>1Ki_1:50</u>, Adonijah, flying to the horns of the altar, upon his good behaviour, is dismissed by Solomon.
1Ki 2:	<b>Overview</b><br><u>1Ki_2:1</u>, David, having given a charge to Solomon, <br><u>1Ki_2:3</u>, of religiousness; <br><u>1Ki_2:5</u>, of Joab; <br><u>1Ki_2:7</u>, of Barzillai; <br><u>1Ki_2:8</u>, of Shimei; <br><u>1Ki_2:10</u>, dies; <br><u>1Ki_2:12</u>, Solomon succeeds; <br><u>1Ki_2:13</u>, Adonijah, moving Bath-sheba to sue unto Solomon for Abishag, is put to death; <br><u>1Ki_2:26</u>, Abiathar, having his life given him, is deprived of the priesthood; <br><u>1Ki_2:28</u>, Joab fleeing to the horns of the altar, is there slain; <br><u>1Ki_2:35</u>, Benaiah is put in Joab's room, and Zadok in Abiathar's; <br><u>1Ki_2:36</u>, Shimei, confined to Jerusalem, by occasion of going thence to Gath, is put to death.
1Ki 3:	<b>Overview</b><br><u>1Ki_3:1</u>, Solomon marries Pharaoh's daughter; <br><u>1Ki_3:2</u>, High places being in use, Solomon sacrifices at Gibeon; <br><u>1Ki_3:5</u>, Solomon at Gibeon, in the choice which God gave him, preferring wisdom, obtains wisdom, riches, and honour; <br><u>1Ki_3:16</u>, Solomon's judgment makes him renowned.
1Ki 4:	<b>Overview</b><br><u>1Ki_4:1</u>, Solomon's princes; <br><u>1Ki_4:7</u>, His twelve officers for provision; <br><u>1Ki_4:20</u>, The peace and largeness of his kingdom; <br><u>1Ki_4:22</u>, His daily provision; <br><u>1Ki_4:26</u>, His stables; <br><u>1Ki_4:29</u>, His wisdom.
1Ki 5:	<b>Overview</b><br><u>1Ki_5:1</u>, Hiram, sending to congratulate Solomon, is desired to furnish him with timber to build the temple; <br><u>1Ki_5:7</u>, Hiram, blessing God for Solomon, and requesting food for his family, furnishes him with trees; <br><u>1Ki_5:13</u>, The number of Solomon's workmen and labourers
1Ki 6:	<b>Overview</b><br><u>1Ki_6:1</u>, The building of Solomon's temple; <br><u>1Ki_6:5</u>, The chambers thereof; <br><u>1Ki_6:11</u>, God's promise unto it; <br><u>1Ki_6:15</u>, The ceiling and adorning of it; <br><u>1Ki_6:23</u>, The cherubims; <br><u>1Ki_6:31</u>, The doors; <br><u>1Ki_6:36</u>, The court; <br><u>1Ki_6:37</u>, The time of building it.
1Ki 7:	<b>Overview</b><br><u>1Ki_7:1</u>, The building of Solomon's house; <br><u>1Ki_7:2</u>, Of the house of Lebanon; <br><u>1Ki_7:6</u>, Of the porch of pillars; <br><u>1Ki_7:7</u>, Of the porch of judgment; <br><u>1Ki_7:8</u>, Of the house for Pharaoh's daughter; <br><u>1Ki_7:13</u>, Hiram's work of the two pillars; <br><u>1Ki_7:23</u>, Of the molten sea; <br><u>1Ki_7:27</u>, Of the ten bases; <br><u>1Ki_7:38</u>, Of the ten lavers, <br><u>1Ki_7:40</u>, and all the vessels.
1Ki 8:	<b>Overview</b><br><u>1Ki_8:1</u>, The feast of the dedication of the temple; <br><u>1Ki_8:12</u>, Solomon's blessing; <br><u>1Ki_8:22</u>, Solomon's prayer; <br><u>1Ki_8:54</u>, Solomon's blessing; <br><u>1Ki_8:62</u>, His sacrifice of peace offerings.
1Ki 9:	<b>Overview</b><br><u>1Ki_9:1</u>, God's covenant in a vision with Solomon; <br><u>1Ki_9:10</u>, The mutual presents of Solomon and Hiram; <br><u>1Ki_9:15</u>, In Solomon's works the Gentiles were his bondmen, the Israelites honourable servants; <br><u>1Ki_9:24</u>, Pharaoh's daughter removes to her house; <br><u>1Ki_9:25</u>, Solomon's yearly solemn sacrifices; <br><u>1Ki_9:26</u>, His navy fetches gold from Ophir.
1Ki 10:	<b>Overview</b><br><u>1Ki_10:1</u>, The queen of Sheba admires the wisdom of Solomon; <br><u>1Ki_10:14</u>, Solomon's gold; <br><u>1Ki_10:16</u>, His targets; <br><u>1Ki_10:18</u>, The throne of ivory; <br><u>1Ki_10:21</u>, His vessels; <br><u>1Ki_10:24</u>, His presents; <br><u>1Ki_10:26</u>, His chariots and horse; <br><u>1Ki_10:28</u>, His tribute.
1Ki 11:	<b>Overview</b><br><u>1Ki_11:1</u>, Solomon's wives and concubines; <br><u>1Ki_11:4</u>, In his old age they draw him to idolatry; <br><u>1Ki_11:9</u>, God threatens him; <br><u>1Ki_11:14</u>, Solomon's adversaries were Hadad, who was entertained in Egypt; <br><u>1Ki_11:23</u>, Rezon, who reigned in Damascus; <br><u>1Ki_11:26</u>, and Jeroboam, to whom Ahijah prophesied; <br><u>1Ki_11:41</u>, Solomon's acts, reign, and death.  Rehoboam succeeds him.
1Ki 12:	<b>Overview</b><br><u>1Ki_12:1</u>, The Israelites, assembled at Shechem to crown Rehoboam, by Jeroboam make a suit of relaxation unto him; <br><u>1Ki_12:6</u>, Rehoboam, refusing the old men's counsel, answers them roughly; <br><u>1Ki_12:16</u>, Ten tribes revolting, kill Adoram, and make Rehoboam flee; <br><u>1Ki_12:21</u>, Rehoboam, raising an army, is forbidden by Shemaiah; <br><u>1Ki_12:25</u>, Jeroboam strengthens himself by cities; <br><u>1Ki_12:26</u>, and by the idolatry of the two calves.
1Ki 13:	<b>Overview</b><br><u>1Ki_13:1</u>, Jeroboam's hand withers, <br><u>1Ki_13:6</u>, and at the prayer of the prophet is restored; <br><u>1Ki_13:7</u>, The prophet departs from Beth-el; <br><u>1Ki_13:11</u>, An old prophet brings him back; <br><u>1Ki_13:20</u>, He is reproved by God, <br><u>1Ki_13:23</u>, slain by a lion, <br><u>1Ki_13:26</u>, buried by the old prophet, <br><u>1Ki_13:31</u>, who confirms his prophecy; <br><u>1Ki_13:33</u>, Jeroboam's obstinacy.
1Ki 14:	<b>Overview</b><br><u>1Ki_14:1</u>, Abijah being sick, Jeroboam sends his wife, disguised, with presents to the prophet Ahijah at Shiloh; <br><u>1Ki_14:5</u>, Ahijah, forewarned by God, denounces God's judgment; <br><u>1Ki_14:17</u>, Abijah dies, and is buried; <br><u>1Ki_14:19</u>, Nadab succeeds Jeroboam; <br><u>1Ki_14:21</u>, Rehoboam's wicked reign; <br><u>1Ki_14:25</u>, Shishak spoils Jerusalem; <br><u>1Ki_14:29</u>, Abijam succeeds Rehoboam.
1Ki 15:	<b>Overview</b><br><u>1Ki_15:1</u>, Abijam's wicked reign; <br><u>1Ki_15:7</u>, Asa succeeds him; <br><u>1Ki_15:9</u>, Asa's good reign; <br><u>1Ki_15:16</u>, The war between Baasha and him causes him to make a league with Bed-hadad; <br><u>1Ki_15:23</u>, Jehoshaphat succeeds Asa; <br><u>1Ki_15:25</u>, Nadab's wicked reign; <br><u>1Ki_15:27</u>, Baasha conspiring against him, executes Ahijah's prophecy; <br><u>1Ki_15:31</u>, Nadab's acts and death; <br><u>1Ki_15:33</u>, Baasha's wicked reign.
1Ki 16:	<b>Overview</b><br><u>1Ki_16:1</u>, Jehu's prophecy against Baasha; <br><u>1Ki_16:5</u>, Elah succeeds him; <br><u>1Ki_16:8</u>, Zimri, conspiring against Elah, succeeds him; <br><u>1Ki_16:11</u>, Zimri executes Jehu's prophecy; <br><u>1Ki_16:15</u>, Omri, made king by the soldiers, forces Zimri desperately to burn himself; <br><u>1Ki_16:21</u>, The kingdom being divided, Omri prevails against Tibni; <br><u>1Ki_16:23</u>, Omri builds Samaria; <br><u>1Ki_16:25</u>, His wicked reign; <br><u>1Ki_16:27</u>, Ahab succeeds him; <br><u>1Ki_16:29</u>, Ahab's most wicked reign; <br><u>1Ki_16:34</u>, Joshua's curse upon Hiel the builder of Jericho.
1Ki 17:	<b>Overview</b><br><u>1Ki_17:1</u>, Elijah, having prophesied against Ahab, is sent to Cherith where the ravens feed him; <br><u>1Ki_17:8</u>, He is sent to the widow of Zarephath; <br><u>1Ki_17:17</u>, He raises the widow's son; <br><u>1Ki_17:24</u>, The woman believes him.
1Ki 18:	<b>Overview</b><br><u>1Ki_18:1</u>, In the extremity of famine Elijah, sent to Ahab, meets good Obadiah; <br><u>1Ki_18:9</u>, Obadiah brings Ahab to Elijah; <br><u>1Ki_18:17</u>, Elijah, reproving Ahab, by fire from heaven convinces Baal's prophets; <br><u>1Ki_18:41</u>, Elijah, by prayer obtaining rain, follows Ahab to Jezreel.
1Ki 19:	<b>Overview</b><br><u>1Ki_19:1</u>, Elijah, threatened by Jezebel, flees to Beer-sheba; <br><u>1Ki_19:4</u>, In the wilderness, being weary of his life, he is comforted by an angel; <br><u>1Ki_19:9</u>, At Horeb God appears unto him, sending him to anoint Hazael, Jehu, and Elisha; <br><u>1Ki_19:19</u>, Elisha, taking leave of his friends, follows Elijah.
1Ki 20:	<b>Overview</b><br><u>1Ki_20:1</u>, Ben-hadad, not content with Ahab's homage, besieges Samaria; <br><u>1Ki_20:13</u>, By the direction of a prophet, the Syrians are slain; <br><u>1Ki_20:22</u>, As the prophet forewarned Ahab, the Syrians, trusting in the valleys, come against him in Aphek; <br><u>1Ki_20:28</u>, By the word of the prophet, and God's judgment, the Syrians are smitten again; <br><u>1Ki_20:31</u>, The Syrians submitting themselves, Ahab sends Ben-hadad away with a covenant; <br><u>1Ki_20:35</u>, The prophet, under the parable of a prisoner, making Ahab judge himself, denounces God's judgment against him.
1Ki 21:	<b>Overview</b><br><u>1Ki_21:1</u>, Ahab being denied Naboth's vineyard, is grieved; <br><u>1Ki_21:5</u>, Jezebel writing letters against Naboth, he is condemned of blasphemy; <br><u>1Ki_21:15</u>, Ahab take possession of the vineyard; <br><u>1Ki_21:17</u>, Elijah denounces judgments against Ahab and Jezebel; <br><u>1Ki_21:25</u>, Wicked Ahab repenting, God defers the judgment.
1Ki 22:	<b>Overview</b><br><u>1Ki_22:1</u>, Ahab, seduced by false prophets, according to the word of Micaiah, is slain at Ramoth-gilead; <br><u>1Ki_22:37</u>, The dogs lick up his blood, and Ahaziah succeeds him; <br><u>1Ki_22:41</u>, Jehoshaphat's good reign; <br><u>1Ki_22:45</u>, His acts; <br><u>1Ki_22:46</u>, Jehoram succeeds him; <br><u>1Ki_22:51</u>, Ahaziah's evil reign.
2Ki 1:	<b>Overview</b><br><u>2Ki_1:1</u>, Moab rebels; <br><u>2Ki_1:2</u>, Ahaziah, sending to Baal-zebub, hath his judgment by Elijah; <br><u>2Ki_1:5</u>, Elijah twice brings fire from heaven upon them whom Ahaziah sent to apprehend him; <br><u>2Ki_1:13</u>, He pities the third captain, and, encouraged by an angel, tells the king of his death; <br><u>2Ki_1:17</u>, Jehoram succeeds Ahaziah.
2Ki 2:	<b>Overview</b><br><u>2Ki_2:1</u>, Elijah, taking his leave of Elisha, with his mantle divides Jordan; <br><u>2Ki_2:9</u>, and, granting Elisha his request, is taken up by a fiery chariot into heaven; <br><u>2Ki_2:12</u>, Elisha, dividing Jordan with Elijah's mantle, is acknowledged his successor; <br><u>2Ki_2:16</u>, The young prophets, hardly obtaining leave to seek Elijah, cannot find him; <br><u>2Ki_2:19</u>, Elisha with salt heals the unwholesome waters; <br><u>2Ki_2:23</u>, Bears destroy the children that mocked Elisha.
2Ki 3:	<b>Overview</b><br><u>2Ki_3:1</u>, Jehoram's reign; <br><u>2Ki_3:4</u>, Mesha rebels; <br><u>2Ki_3:6</u>, Jehoram, with Jehoshaphat, and the king of Edom, being distressed for want of water, by Elisha obtains water, and promise of victory; <br><u>2Ki_3:21</u>, The Moabites, deceived by the colour of the water, coming to spoil, are overcome; <br><u>2Ki_3:26</u>, The king of Moab, failing in his attempt to break through to the king of Edom, sacrifices his son, and raises the siege.
2Ki 4:	<b>Overview</b><br><u>2Ki_4:1</u>, Elisha multiplies the widow's oil; <br><u>2Ki_4:8</u>, He obtains a son for the good Shunammite; <br><u>2Ki_4:18</u>, He restores her son when dead; <br><u>2Ki_4:38</u>, At Gilgal he heals the deadly pottage; <br><u>2Ki_4:42</u>, He satisfies an hundred men with twenty loaves.
2Ki 5:	<b>Overview</b><br><u>2Ki_5:1</u>, Naaman, by the report of a captive maid, is sent to Samaria to be cured of his leprosy; <br><u>2Ki_5:8</u>, Elisha, sending him to Jordan cures him; <br><u>2Ki_5:15</u>, He refusing Naaman's gifts grants him some of the earth; <br><u>2Ki_5:20</u>, Gehazi, abusing his master's name unto Naaman, is smitten with leprosy.
2Ki 6:	<b>Overview</b><br><u>2Ki_6:1</u>, Elisha, giving leave to the young prophets to enlarge their dwellings, causes iron to swim; <br><u>2Ki_6:8</u>, He discloses the king of Syria's counsel; <br><u>2Ki_6:13</u>, The army which was sent to Dothan to apprehend Elisha, is smitten with blindness; <br><u>2Ki_6:19</u>, Being brought into Samaria, they are dismissed in peace; <br><u>2Ki_6:24</u>, The famine in Samaria causes women to eat their own children; <br><u>2Ki_6:30</u>, The king sends to slay Elisha.
2Ki 7:	<b>Overview</b><br><u>2Ki_7:1</u>, Elisha prophesies incredible plenty in Samaria; <br><u>2Ki_7:3</u>, Four lepers, venturing on the host of the Syrians, bring tidings of their flight; <br><u>2Ki_7:12</u>, The king, finding by spies the news to be true, spoils the tents of the Syrians; <br><u>2Ki_7:17</u>, The lord who would not believe the prophecy of plenty, having the charge of the gate, is trodden to death in the press.
2Ki 8:	<b>Overview</b><br><u>2Ki_8:1</u>, The Shunammite, having left her country seven years, to avoid the forewarned famine, for Elisha's miracle's sake has her land restored by the king; <br><u>2Ki_8:7</u>, Hazael, being sent with a present by Ben-hadad to Elisha at Damascus, after he had heard the prophecy, kills his master, and succeeds him; <br><u>2Ki_8:16</u>, Jehoram's wicked reign in Judah; <br><u>2Ki_8:20</u>, Edom and Libnah revolt; <br><u>2Ki_8:23</u>, Ahaziah succeeds Jehoram; <br><u>2Ki_8:25</u>, Ahaziah's wicked reign; <br><u>2Ki_8:28</u>, He visits Joram, being wounded, at Jezreel.
2Ki 9:	<b>Overview</b><br><u>2Ki_9:1</u>, Elisha sends a young prophet with instructions to anoint Jehu at Ramoth-gilead; <br><u>2Ki_9:4</u>, The prophet having done his message, flees; <br><u>2Ki_9:11</u>, Jehu, being made king by the soldiers, kills Joram in the field of Naboth; <br><u>2Ki_9:27</u>, Ahaziah is slain at Gur, and buried at Jerusalem; <br><u>2Ki_9:30</u>, Proud Jezebel is thrown down out of a window, and eaten by dogs.
2Ki 10:	<b>Overview</b><br><u>2Ki_10:1</u>, Jehu, by his letters, causes seventy of Ahab's children to be beheaded; <br><u>2Ki_10:8</u>, He excuses the fact by the prophecy of Elijah; <br><u>2Ki_10:12</u>, At the shearing house he slays two and forty of Ahaziah's brethren; <br><u>2Ki_10:15</u>, He takes Jehonadab into his company; <br><u>2Ki_10:18</u>, By subtilty he destroys all the worshippers of Baal; <br><u>2Ki_10:29</u>, Jehu follows Jeroboam's sins; <br><u>2Ki_10:32</u>, Hazael oppresses Israel; <br><u>2Ki_10:34</u>, Jehoahaz succeeds Jehu.
2Ki 11:	<b>Overview</b><br><u>2Ki_11:1</u>, Jehoash, being saved by Jehosheba his aunt from Athaliah's massacre of the seed royal, is hid six years in the house of God; <br><u>2Ki_11:4</u>, Jehoiada, giving order to the captains, in the seventh year anoints him king; <br><u>2Ki_11:13</u>, Athaliah is slain; <br><u>2Ki_11:17</u>, Jehoiada restores the worship of God.
2Ki 12:	<b>Overview</b><br><u>2Ki_12:1</u>, Jehoash reigns well all the days of Jehoiada; <br><u>2Ki_12:4</u>, He gives order for the repair of the temple; <br><u>2Ki_12:17</u>, Hazael is diverted from Jerusalem by a present of the hallowed treasures; <br><u>2Ki_12:19</u>, Jehoash being slain, Amaziah succeeds him.
2Ki 13:	<b>Overview</b><br><u>2Ki_13:1</u>, Jehoahaz's wicked reign; <br><u>2Ki_13:3</u>, Jehoahaz, oppressed by Hazael, is relieved by prayer; <br><u>2Ki_13:8</u>, Joash succeeds him; <br><u>2Ki_13:10</u>, His wicked reign; <br><u>2Ki_13:12</u>, Jeroboam succeeds him; <br><u>2Ki_13:14</u>, Elisha dying, prophesies to Joash three victories over the Syrians; <br><u>2Ki_13:20</u>, The Moabites invading the land, Elisha's bones raise a dead man; <br><u>2Ki_13:22</u>, Joash gets three victories over Ben-hadad.
2Ki 14:	<b>Overview</b><br><u>2Ki_14:1</u>, Amaziah's good reign; <br><u>2Ki_14:5</u>, His justice on the murderers of his father; <br><u>2Ki_14:7</u>, His victory over Edom; <br><u>2Ki_14:8</u>, Amaziah, provoking Jehoash, is overcome and spoiled; <br><u>2Ki_14:15</u>, Jeroboam succeeds Jehoash; <br><u>2Ki_14:17</u>, Amaziah slain by a conspiracy; <br><u>2Ki_14:21</u>, Azariah succeeds him; v.23, Jeroboam's wicked reign; v.28, Zachariah succeeds him.
2Ki 15:	<b>Overview</b><br><u>2Ki_15:1</u>, Azariah's good reign; <br><u>2Ki_15:5</u>, He dying a leper, Jotham succeeds; <br><u>2Ki_15:8</u>, Zachariah the last of Jehu's generation, reigning ill, is slain by Shallum; <br><u>2Ki_15:13</u>, Shallum, reigning a month, is slain by Menahem; <br><u>2Ki_15:16</u>, Menahem strengthens himself by Pul; <br><u>2Ki_15:21</u>, Pekahiah succeeds him; <br><u>2Ki_15:23</u>, Pekahiah is slain by Pekah; <br><u>2Ki_15:27</u>, Pekah is oppressed by Tiglath-pileser, and slain by Hoshea; <br><u>2Ki_15:32</u>, Jotham's good reign; <br><u>2Ki_15:36</u>, Ahaz succeeds him.
2Ki 16:	<b>Overview</b><br><u>2Ki_16:1</u>, Ahaz's wicked reign; <br><u>2Ki_16:5</u>, Ahaz, assailed by Rezin and Pekah, hires Tiglath-pileser against them; <br><u>2Ki_16:10</u>, Ahaz, sending a pattern of an altar from Damascus to Urijah, diverts the brazen altar to his own devotions; <br><u>2Ki_16:17</u>, He spoils the temple; <br><u>2Ki_16:19</u>, Hezekiah succeeds him.
2Ki 17:	<b>Overview</b><br><u>2Ki_17:1</u>, Hoshea's wicked reign; <br><u>2Ki_17:3</u>, Being subdued by Shalmaneser, he conspires against him with So, king of Egypt; <br><u>2Ki_17:5</u>, Samaria for sinning is led into captivity; <br><u>2Ki_17:24</u>, The strange nations which were transplanted into Samaria, being plagued with lions, make a mixture of religions.
2Ki 18:	<b>Overview</b><br><u>2Ki_18:1</u>, Hezekiah's good reign; <br><u>2Ki_18:4</u>, He destroys idolatry, and prospers; <br><u>2Ki_18:9</u>, The inhabitants of Samaria are carried captive for their sins; <br><u>2Ki_18:13</u>, Sennacherib invading Judah, is pacified by a tribute; <br><u>2Ki_18:17</u>, Rab-shakeh, by blasphemous persuasions, solicits the people to revolt.
2Ki 19:	<b>Overview</b><br><u>2Ki_19:1</u>, Hezekiah mourning, sends to Isaiah to pray for them; <br><u>2Ki_19:6</u>, Isaiah comforts them; <br><u>2Ki_19:8</u>, Sennacherib, going to encounter Tirhakah, sends a blasphemous letter to Hezekiah; <br><u>2Ki_19:14</u>, Hezekiah's prayer; <br><u>2Ki_19:20</u>, Isaiah's prophecy of the pride and destruction of Sennacherib, and the good of Zion; <br><u>2Ki_19:35</u>, An angel slays the Assyrians; <br><u>2Ki_19:36</u>, Sennacherib is slain by his own sons.
2Ki 20:	<b>Overview</b><br><u>2Ki_20:1</u>, Hezekiah, having received a message of death, by prayer has his life lengthened; <br><u>2Ki_20:8</u>, The sun goes ten degrees backward for a sign of that promise; <br><u>2Ki_20:12</u>, Berodach-baladan sending to visit Hezekiah, because of the wonder, has notice of his treasures; <br><u>2Ki_20:14</u>, Isaiah understanding thereof, foretells the Babylonian captivity; <br><u>2Ki_20:20</u>, Manasseh succeeds Hezekiah.
2Ki 21:	<b>Overview</b><br><u>2Ki_21:1</u>, Manasseh's reign; <br><u>2Ki_21:3</u>, His great idolatry; <br><u>2Ki_21:10</u>, His wickedness causes prophecies against Judah; <br><u>2Ki_21:17</u>, Amon succeeds him; <br><u>2Ki_21:19</u>, Amon's wicked reign; <br><u>2Ki_21:23</u>, He being slain by his servants, and those murderers slain by the people, Josiah is made king.
2Ki 22:	<b>Overview</b><br><u>2Ki_22:1</u>, Josiah's good reign; <br><u>2Ki_22:3</u>, He takes care for the repair of the temple; <br><u>2Ki_22:8</u>, Hilkiah having found a book of the law, Josiah sends to Huldah to enquire of the Lord; <br><u>2Ki_22:15</u>, Huldah prophesies the destruction of Jerusalem, but respite thereof in Josiah's time.
2Ki 23:	<b>Overview</b><br><u>2Ki_23:1</u>, Josiah causes the book to be read in a solemn assembly; <br><u>2Ki_23:3</u>, He renews the covenant of the Lord; <br><u>2Ki_23:4</u>, He destroys idolatry; <br><u>2Ki_23:15</u>, He burns dead men's bones upon the altar of Beth-el, as was fore-prophesied; <br><u>2Ki_23:21</u>, He keeps a most solemn passover; <br><u>2Ki_23:24</u>, He puts away witches and all abomination; <br><u>2Ki_23:26</u>, God's final wrath against Judah; <br><u>2Ki_23:29</u>, Josiah, provoking Pharaoh-nechoh, is slain at Megiddo; <br><u>2Ki_23:31</u>, Jehoahaz, succeeding him, is imprisoned by Pharaoh-nechoh, who makes Jehoiakim king; <br><u>2Ki_23:36</u>, Jehoiakim's wicked reign.
2Ki 24:	<b>Overview</b><br><u>2Ki_24:1</u>, Jehoiakim, first subdued by Nebuchadnezzar, then rebelling against him, procures his own ruin; <br><u>2Ki_24:5</u>, Jehoiachin succeeds him; <br><u>2Ki_24:7</u>, The king of Egypt is vanquished by the king of Babylon; <br><u>2Ki_24:8</u>, Jehoiachin's evil reign; <br><u>2Ki_24:10</u>, Jerusalem is taken and carried captive into Babylon; <br><u>2Ki_24:17</u>, Zedekiah is made king, and reigns ill, unto the utter destruction of Judah.
2Ki 25:	<b>Overview</b><br><u>2Ki_25:1</u>, Jerusalem is besieged; <br><u>2Ki_25:4</u>, Zedekiah taken, his sons slain, his eyes put out; <br><u>2Ki_25:8</u>, Nebuzar-adan defaces the city, carries the remnant, except a few poor labourers, into captivity; <br><u>2Ki_25:13</u>, and spoils and carries away the treasures; <br><u>2Ki_25:18</u>, The nobles are slain at Riblah; <br><u>2Ki_25:22</u>, Gedaliah, who was over them that remained, being slain, the rest flee into Egypt; <br><u>2Ki_25:27</u>, Evil-merodach advances Jehoiachin in his court.
1Ch 1:	<b>Overview</b><br><u>1Ch_1:1</u>, Adam's line to Noah; <br><u>1Ch_1:5</u>, The sons of Japheth; <br><u>1Ch_1:8</u>, The sons of Ham; <br><u>1Ch_1:17</u>, The sons of Shem; <br><u>1Ch_1:24</u>, Shem's line to Abraham; <br><u>1Ch_1:29</u>, Ishmael's sons; <br><u>1Ch_1:32</u>, The sons of Keturah; <br><u>1Ch_1:34</u>, The posterity of Abraham by Esau; <br><u>1Ch_1:38</u>, The sons of Seir; <br><u>1Ch_1:43</u>, The kings of Edom; <br><u>1Ch_1:51</u>, The dukes of Edom.
1Ch 2:	<b>Overview</b><br><u>1Ch_2:1</u>, The sons of Israel; <br><u>1Ch_2:3</u>, The posterity of Judah by Tamar; <br><u>1Ch_2:13</u>, The children of Jesse; <br><u>1Ch_2:18</u>, The posterity of Caleb the son of Hezron; <br><u>1Ch_2:21</u>, Hezron's posterity by the daughter of Machir; <br><u>1Ch_2:25</u>, Jerahmeel's posterity; <br><u>1Ch_2:34</u>, Sheshan's posterity; <br><u>1Ch_2:42</u>, Another branch of Caleb's posterity; <br><u>1Ch_2:50</u>, The posterity of Caleb the son of Hur.
1Ch 3:	<b>Overview</b><br><u>1Ch_3:1</u>, The sons of David; <br><u>1Ch_3:10</u>, His line to Zedekiah; <br><u>1Ch_3:17</u>, The successors of Jeconiah.
1Ch 4:	<b>Overview</b><br><u>1Ch_4:1</u>, The posterity of Judah by Caleb, the son of Hur; <br><u>1Ch_4:5</u>, Of Ashur, the posthumous son Hezron; <br><u>1Ch_4:9</u>, Of Jabez, and his prayer; <br><u>1Ch_4:11</u>, The other families of the same stock; <br><u>1Ch_4:21</u>, The sons of Shelah; <br><u>1Ch_4:24</u>, The posterity and cities of Simeon; <br><u>1Ch_4:39</u>, Their conquest of Gedor, and of the Amalekites in mount Seir.
1Ch 5:	<b>Overview</b><br><u>1Ch_5:1</u>, Judah and Joseph preferred before Reuben, who forfeited his birthright; <br><u>1Ch_5:3</u>, Ruben's descendants; some of whom vanquish the Hagarites; <br><u>1Ch_5:11</u>, The chief men of Gad, and their habitations; <br><u>1Ch_5:18</u>, Ruben, Gad, and half of Manasseh, obtain a victory over the Hagarites; <br><u>1Ch_5:23</u>, The habitations and chief men of that half of Manasseh; <br><u>1Ch_5:25</u>, The captivity of the two tribes and half, for their sins.
1Ch 6:	<b>Overview</b><br><u>1Ch_6:1</u>, The sons of Levi; <br><u>1Ch_6:4</u>, The line of Eleazar unto the captivity; <br><u>1Ch_6:16</u>, The families of Gershom, Kohath, and Merari; <br><u>1Ch_6:49</u>, The office of Aaron, and his line unto Ahimaaz; <br><u>1Ch_6:54</u>, The cities of the priests and Levites.
1Ch 7:	<b>Overview</b><br><u>1Ch_7:1</u>, The sons of Issachar; <br><u>1Ch_7:6</u>, of Benjamin; <br><u>1Ch_7:13</u>, of Naphtali; <br><u>1Ch_7:14</u>, of Manasseh; <br><u>1Ch_7:15</u>, and of Ephraim; <br><u>1Ch_7:21</u>, The calamity of Ephraim by the men of Gath; <br><u>1Ch_7:23</u>, His posterity by Beriah; <br><u>1Ch_7:28</u>, Their habitations; <br><u>1Ch_7:30</u>, The sons of Asher.
1Ch 8:	<b>Overview</b><br><u>1Ch_8:1</u>, The sons and chief men of Benjamin; <br><u>1Ch_8:33</u>, The stock of Saul and Jonathan.
1Ch 9:	<b>Overview</b><br><u>1Ch_9:1</u>, The original of Israel and Judah's genealogies; <br><u>1Ch_9:2</u>, The Israelites; <br><u>1Ch_9:10</u>, the priests; <br><u>1Ch_9:14</u>, and the Levites, with Nethinims, which dwelt in Jerusalem; <br><u>1Ch_9:27</u>, The charge of certain Levites; <br><u>1Ch_9:35</u>, The stock of Saul and Jonathan.
1Ch 10:	<b>Overview</b><br><u>1Ch_10:1</u>, Saul's overthrow and death; <br><u>1Ch_10:8</u>, The Philistines triumph over Saul; <br><u>1Ch_10:11</u>, The kindness of Jabesh-gilead towards Saul and his sons; <br><u>1Ch_10:13</u>, Saul's sin, for which the kingdom was translated from him to David.
1Ch 11:	<b>Overview</b><br><u>1Ch_11:1</u>, David by general consent is made king at Hebron; <br><u>1Ch_11:4</u>, He wins the castle of Zion from the Jebusites by Joab's valour; <br><u>1Ch_11:10</u>, A catalogue of David's mighty men.
1Ch 12:	<b>Overview</b><br><u>1Ch_12:1</u>, The companies that came to David at Ziklag; <br><u>1Ch_12:23</u>, The armies that came to him at Hebron.
1Ch 13:	<b>Overview</b><br><u>1Ch_13:1</u>, David fetches the ark with great solemnity from Kirjath- jearim; <br><u>1Ch_13:9</u>, Uzza being smitten, the ark is left at the house of Obed- edom.
1Ch 14:	<b>Overview</b><br><u>1Ch_14:1</u>, Hiram's kindness to David; <br><u>1Ch_14:2</u>, David's felicity in people, wives, and children; <br><u>1Ch_14:8</u>, His two victories against the Philistines.
1Ch 15:	<b>Overview</b><br><u>1Ch_15:1</u>, David having prepared a place for the ark, the priests and Levites bring it from Obed-edom; <br><u>1Ch_15:25</u>, He performs the solemnity thereof with great joy; <br><u>1Ch_15:29</u>, Michal despises him.
