Zec 3:	<b>Overview</b><br><u>Zec_3:1</u>, Under the type of Joshua, the high priest, receiving clean garments, v.6, and a covenant of promise, v.8, Christ the Branch and Corner Stone is promised.
Zec 4:	<b>Overview</b><br><u>Zec_4:1</u>, By the golden candlestick is foreshewn the good success of Zerubbabel's foundation; <br><u>Zec_4:11</u>, by the two olive trees the two anointed ones.
Zec 5:	<b>Overview</b><br><u>Zec_5:1</u>, By the flying roll is shewn the curse of thieves and swearers; <br><u>Zec_5:5</u>, and by a woman pressed in an ephah the final judgment of wickedness.
Zec 6:	<b>Overview</b><br><u>Zec_6:1</u>, The vision of the four chariots; <br><u>Zec_6:9</u>, By the crowns of Joshua are shewn the temple and kingdom of Christ the Branch.
Zec 7:	<b>Overview</b><br><u>Zec_7:1</u>, The captives enquire concerning the set fasts; <br><u>Zec_7:4</u>, Zechariah reproves the hypocrisy of their fasting; <br><u>Zec_7:8</u>, Sin the cause of their captivity.
Zec 8:	<b>Overview</b><br><u>Zec_8:1</u>, The restoration of Jerusalem; <br><u>Zec_8:9</u>, They are encouraged to build the temple by God's favour to them; <br><u>Zec_8:16</u>, Good works are required of them; <br><u>Zec_8:18</u>, Joy and enlargement are promised.
Zec 9:	<b>Overview</b><br><u>Zec_9:1</u>, God defends his church; <br><u>Zec_9:9</u>, Zion is exhorted to rejoice for the coming of Christ, and his peaceable kingdom; <br><u>Zec_9:12</u>, God's promises of victory and defence.
Zec 10:	<b>Overview</b><br><u>Zec_10:1</u>, God is to be sought unto, and not idols; <br><u>Zec_10:3</u>, As he visited his flock for sin, so he will save and restore them.
Zec 11:	<b>Overview</b><br><u>Zec_11:1</u>, The destruction of Jerusalem; <br><u>Zec_11:3</u>, The elect being cared for, the rest are rejected; <br><u>Zec_11:10</u>, The staves of Beauty and Bands broken by the rejection of Christ; <br><u>Zec_11:15</u>, The type and curse of a foolish shepherd.
Zec 12:	<b>Overview</b><br><u>Zec_12:1</u>, Jerusalem a cup of trembling to herself, <br><u>Zec_12:3</u>, and a burdensome stone to her adversaries; <br><u>Zec_12:6</u>, The victorious restoring of Judah; <br><u>Zec_12:10</u>, The repentance of Jerusalem.
Zec 13:	<b>Overview</b><br><u>Zec_13:1</u>, The fountain of purgation for Jerusalem, <br><u>Zec_13:2</u>, from idolatry, and false prophecy; <br><u>Zec_13:7</u>, The death of Christ, and the trial of a third part.
Zec 14:	<b>Overview</b><br><u>Zec_14:1</u>, The destroyers of Jerusalem destroyed; <br><u>Zec_14:3</u>, The coming of Christ, and the graces of his kingdom; <br><u>Zec_14:12</u>, The plague of Jerusalem's enemies; <br><u>Zec_14:16</u>, The remnant shall turn to the Lord; <br><u>Zec_14:20</u>, and their spoils shall be holy.
Mal 1:	<b>Overview</b><br><u>Mal_1:1</u>, Malachi complains of Israel's unkindness; <br><u>Mal_1:2</u>, of their irreligiousness and profaneness.
Mal 2:	<b>Overview</b><br><u>Mal_2:1</u>, He sharply reproves the priests for neglecting their covenant; <br><u>Mal_2:10</u>, and the people for marrying strange wives; <br><u>Mal_2:13</u>, and for putting away their former ones, <br><u>Mal_2:17</u>. and for infidelity.
Mal 3:	<b>Overview</b><br><u>Mal_3:1</u>, Of the messenger, majesty, and grace of Christ; <br><u>Mal_3:7</u>, Of the rebellion, <br><u>Mal_3:8</u>, sacrilege, <br><u>Mal_3:13</u>. and infidelity of the people; <br><u>Mal_3:16</u>, The promise of blessing to them that fear God.
Mal 4:	<b>Overview</b><br><u>Mal_4:1</u>, God's judgment on the wicked; <br><u>Mal_4:2</u>, and his blessing on the good; <br><u>Mal_4:4</u>, He exhorts to the study of the law; <br><u>Mal_4:5</u>, and tells of Elijah's coming and office.
Mat 1:	<b>Overview</b><br><u>Mat_1:1</u>, The genealogy of Christ from Abraham to Joseph; <br><u>Mat_1:18</u>, He is miraculously conceived of the Holy Ghost by the Virgin Mary, when she was espoused to Joseph; <br><u>Mat_1:19</u>, The angel satisfies the doubts of Joseph, and declares the names and office of Christ:  Jesus is born.
Mat 2:	<b>Overview</b><br><u>Mat_2:1</u>, The wise men from the east enquire after Christ; <br><u>Mat_2:3</u>, at which Herod is alarmed; <br><u>Mat_2:9</u>, They are directed by a star to Bethlehem, worship him, and offer their presents; <br><u>Mat_2:13</u>, Joseph flees into Egypt with Jesus and his mother; <br><u>Mat_2:16</u>, Herod slays the children; <br><u>Mat_2:20</u>, himself dies; <br><u>Mat_2:23</u>, Christ is brought back again into Galilee to Nazareth.
Mat 3:	<b>Overview</b><br><u>Mat_3:1</u>, John preaches.  his office, life, and baptism; <br><u>Mat_3:7</u>, He reprehends the Pharisees, <br><u>Mat_3:13</u>. and baptizes Christ in Jordan.
Mat 4:	<b>Overview</b><br><u>Mat_4:1</u>, Christ, fasting forty days, is tempted of the devil and ministered unto by angels; <br><u>Mat_4:12</u>, He dwells in Capernaum; <br><u>Mat_4:17</u>, begins to preach; <br><u>Mat_4:18</u>, calls Peter and Andrew, <br><u>Mat_4:21</u>. James and John; v.23, teaches and heals all the diseased.
Mat 5:	<b>Overview</b><br><u>Mat_5:1</u>, Christ's sermon on the mount; <br><u>Mat_5:3</u>, Who are blessed; <br><u>Mat_5:13</u>, the salt of the earth; <br><u>Mat_5:14</u>, the light of the world; <br><u>Mat_5:17</u>, He came to fulfil the law; <br><u>Mat_5:21</u>, What it is to kill; <br><u>Mat_5:27</u>, to commit adultery; <br><u>Mat_5:33</u>, to swear; <br><u>Mat_5:38</u>, He exhorts to suffer wrong, <br><u>Mat_5:43</u>. to love our enemies; <br><u>Mat_5:48</u>, and to labour after perfection.
Mat 6:	<b>Overview</b><br><u>Mat_6:1</u>, Christ continues his sermon on the mount, exhorting not to be careful for worldly things, <br><u>Mat_6:33</u>. but to seek God's kingdom.
Mat 7:	<b>Overview</b><br><u>Mat_7:1</u>, Christ, continuing his sermon on the mount, reproves rash judgment, etc; <br><u>Mat_7:28</u>, Christ ends his sermon, and the people are astonished.
Mat 8:	<b>Overview</b><br><u>Mat_8:1</u>, Christ cleanses the leper; <br><u>Mat_8:5</u>, heals the centurion's servant, <br><u>Mat_8:14</u>. Peter's mother in law, <br><u>Mat_8:16</u>. and many other diseased; <br><u>Mat_8:18</u>, shows how he is to be followed; <br><u>Mat_8:23</u>, stills the tempest on the sea; <br><u>Mat_8:28</u>, drives the devils out of two men possessed; <br><u>Mat_8:31</u>, and suffers them to go into the swine.
Mat 9:	<b>Overview</b><br><u>Mat_9:1</u>, Christ cures one sick of the palsy; <br><u>Mat_9:9</u>, calls Matthew from the receipt of custom; <br><u>Mat_9:10</u>, eats with publicans and sinners; <br><u>Mat_9:14</u>, defends his disciples for not fasting; <br><u>Mat_9:20</u>, cures the bloody issue; <br><u>Mat_9:23</u>, raises from death Jairus' daughter; <br><u>Mat_9:27</u>, gives sight to two blind men; <br><u>Mat_9:32</u>, heals a dumb man possessed of a devil; <br><u>Mat_9:36</u>, and has compassion on the multitude.
Mat 10:	<b>Overview</b><br><u>Mat_10:1</u>, Christ sends out his twelve apostles, enabling them with power to do miracles; <br><u>Mat_10:5</u>, giving them their charge, teaches them; <br><u>Mat_10:16</u>, comforts them against persecutions; <br><u>Mat_10:40</u>, and promises a blessing to those that receive them.
Mat 11:	<b>Overview</b><br><u>Mat_11:1</u>, John sends his disciples to Christ; <br><u>Mat_11:7</u>, Christ's testimony concerning John; <br><u>Mat_11:16</u>, The perverse judgment of the people; <br><u>Mat_11:20</u>, Christ upbraids Chorazin, Bethsaida, and Capernaum; <br><u>Mat_11:25</u>, and praising his Father's wisdom in revealing the Gospel to the simple, <br><u>Mat_11:28</u>. he calls to him all such as feel the burden of their sins.
Mat 12:	<b>Overview</b><br><u>Mat_12:1</u>, Christ reproves the blindness of the Pharisees concerning the breach of the sabbath, <br><u>Mat_12:3</u>, by scripture, <br><u>Mat_12:9</u>, by reason, <br><u>Mat_12:13</u>. and by a miracle; <br><u>Mat_12:22</u>, He heals a man possessed that was blind and dumb; <br><u>Mat_12:24</u>, and confuting the absurd charge of casting out devils by Beelzebub, he shows that blasphemy against the Holy Ghost shall never be forgiven; <br><u>Mat_12:36</u>, Account shall be made of idle words; <br><u>Mat_12:38</u>, He rebukes the unfaithful, who seek after a sign, <br><u>Mat_12:46</u>. and shows who is his brother, sister, and mother.
Mat 13:	<b>Overview</b><br><u>Mat_13:1</u>, The parable of the sower and the seed; <br><u>Mat_13:18</u>, the exposition of it; <br><u>Mat_13:24</u>, The parable of the tares; <br><u>Mat_13:31</u>, of the mustard seed; <br><u>Mat_13:33</u>, of the leaven; <br><u>Mat_13:36</u>, exposition of the parable of the tares; <br><u>Mat_13:44</u>, The parable of the hidden treasure; <br><u>Mat_13:45</u>, of the pearl; <br><u>Mat_13:47</u>, of the drag net cast into the sea; <br><u>Mat_13:53</u>, Christ is contemned of his own countrymen.
Mat 14:	<b>Overview</b><br><u>Mat_14:1</u>, Herod's opinion of Christ; <br><u>Mat_14:3</u>, Wherefore John Baptist was beheaded; <br><u>Mat_14:13</u>, Jesus departs into a desert place, <br><u>Mat_14:15</u>. where he feeds five thousand men with five loves and two fishes; <br><u>Mat_14:22</u>, He walks on the sea to his disciples; <br><u>Mat_14:34</u>, and landing at Gennesaret, heals the sick by the touch of the hem of his garment.
Mat 15:	<b>Overview</b><br><u>Mat_15:1</u>, Christ reproves the Scribes and Pharisees for transgressing God's commandments through their own traditions; <br><u>Mat_15:10</u>, teaches how that which goes into the mouth does not defile a man; <br><u>Mat_15:21</u>, He heals the daughter of the woman of Canaan, <br><u>Mat_15:29</u>. and other great multitudes; <br><u>Mat_15:32</u>, and with seven loaves and a few little fishes feeds four thousand men, beside women and children.
Mat 16:	<b>Overview</b><br><u>Mat_16:1</u>, The Pharisees require a sign; <br><u>Mat_16:5</u>, Jesus warns his disciples of the leaven of the Pharisees and Sadducees; <br><u>Mat_16:13</u>, The people's opinion of Christ, <br><u>Mat_16:16</u>. and Peter's confession of him; <br><u>Mat_16:21</u>, Jesus foretells his death; <br><u>Mat_16:23</u>, reproves Peter for dissuading him from it; <br><u>Mat_16:24</u>, and admonishes those that will follow him, to bear the cross.
Mat 17:	<b>Overview</b><br><u>Mat_17:1</u>, The transfiguration of Christ; <br><u>Mat_17:14</u>, He heals the lunatic, <br><u>Mat_17:22</u>. foretells his own passion, <br><u>Mat_17:24</u>. and pays tribute.
Mat 18:	<b>Overview</b><br><u>Mat_18:1</u>, Christ warns his disciples to be humble and harmless, <br><u>Mat_18:7</u>, to avoid offences, <br><u>Mat_18:10</u>. and not to despise the little ones; <br><u>Mat_18:15</u>, teaches how we are to deal with our brethren when they offend us, <br><u>Mat_18:21</u>. and how oft to forgive them; <br><u>Mat_18:23</u>, which he sets forth by a parable of the king that took account of his servants, <br><u>Mat_18:32</u>. and punished him who shewed no mercy to his fellow.
Mat 19:	<b>Overview</b><br><u>Mat_19:1</u>, Christ heals the sick; <br><u>Mat_19:3</u>, answers the Pharisees concerning divorcement; <br><u>Mat_19:10</u>, shows when marriage is necessary; <br><u>Mat_19:13</u>, receives little children; <br><u>Mat_19:16</u>, instructs the young man how to attain eternal life; <br><u>Mat_19:20</u>, and how to be perfect; <br><u>Mat_19:23</u>, tells his disciples how hard it is for a rich man to enter into the kingdom of God; <br><u>Mat_19:27</u>, and promises reward to those that forsake anything to follow him.
Mat 20:	<b>Overview</b><br><u>Mat_20:1</u>, Christ, by the similitude of the labourers in the vineyard, shows that God is debtor unto no man; <br><u>Mat_20:17</u>, foretells his passion; <br><u>Mat_20:20</u>, by answering the mother of Zebedee's children, teaches his disciples to be lowly; <br><u>Mat_20:29</u>, and gives two blind men their sight.
Mat 21:	<b>Overview</b><br><u>Mat_21:1</u>, Christ rides into Jerusalem upon an ass; <br><u>Mat_21:12</u>, drives the buyers and sellers out of the temple; <br><u>Mat_21:17</u>, curses the fig-tree; <br><u>Mat_21:23</u>, puts to silence the priests and elders, <br><u>Mat_21:28</u>. and rebukes them by the similitude of the two sons, <br><u>Mat_21:33</u>. and the husbandmen who slew such as were sent to them.
Mat 22:	<b>Overview</b><br><u>Mat_22:1</u>, The parable of the marriage of the king's son; <br><u>Mat_22:9</u>, The vocation of the Gentiles; <br><u>Mat_22:12</u>, The punishment of him that wanted the wedding garment; <br><u>Mat_22:15</u>, Tribute ought to be paid to Caesar; <br><u>Mat_22:23</u>, Christ confutes the Sadducees for the resurrection; <br><u>Mat_22:34</u>, answers the lawyer, which is the first and great commandment; <br><u>Mat_22:41</u>, and puzzles the Pharisees by a question about the Messias.
Mat 23:	<b>Overview</b><br><u>Mat_23:1</u>, Christ admonishes the people to follow the good doctrine, not the evil examples, of the Scribes and Pharisees; <br><u>Mat_23:5</u>, His disciples must beware of their ambition; <br><u>Mat_23:13</u>, He denounces eight woes against their hypocrisy and blindness, <br><u>Mat_23:34</u>. and prophesies of the destruction of Jerusalem.
Mat 24:	<b>Overview</b><br><u>Mat_24:1</u>, Christ foretells the destruction of the temple; <br><u>Mat_24:3</u>, what and how great calamities shall be before it; <br><u>Mat_24:29</u>, the signs of his coming to judgment; <br><u>Mat_24:36</u>, And because that day and hour are unknown, <br><u>Mat_24:42</u>. we ought to watch like good servants, expecting every moment our Master's coming.
Mat 25:	<b>Overview</b><br><u>Mat_25:1</u>, The parable of the ten virgins, <br><u>Mat_25:14</u>. and of the talents; <br><u>Mat_25:31</u>, Also the description of the last judgment.
Mat 26:	<b>Overview</b><br><u>Mat_26:1</u>, Christ foretells his own death; <br><u>Mat_26:3</u>, The rulers conspire against him; <br><u>Mat_26:6</u>, The woman anoints his feet; <br><u>Mat_26:14</u>, Judas bargains to betray him; <br><u>Mat_26:17</u>, Christ eats the passover; <br><u>Mat_26:26</u>, institutes his holy supper; <br><u>Mat_26:30</u>, foretells the desertion of his disciples, and Peter's denial; <br><u>Mat_26:36</u>, prays in the garden; <br><u>Mat_26:47</u>, and being betrayed by a kiss, <br><u>Mat_26:57</u>. is carried to Caiaphas, <br><u>Mat_26:69</u>. and denied of Peter.
Mat 27:	<b>Overview</b><br><u>Mat_27:1</u>, Christ is delivered bound to Pilate; <br><u>Mat_27:3</u>, Judas hangs himself; <br><u>Mat_27:19</u>, Pilate, admonished of his wife, <br><u>Mat_27:20</u>. and being urged by the multitude, washes his hands, and looses Barabbas; <br><u>Mat_27:27</u>, Christ is mocked and crowned with thorns; <br><u>Mat_27:33</u>, crucified; <br><u>Mat_27:39</u>, reviled; <br><u>Mat_27:50</u>, dies, and is buried; <br><u>Mat_27:62</u>, his sepulchre is sealed and watched.
Mat 28:	<b>Overview</b><br><u>Mat_28:1</u>, Christ's resurrection is declared by an angel to the women; <br><u>Mat_28:9</u>, He himself appears unto them; <br><u>Mat_28:11</u>, The chief priests give the soldiers money to say that he was stolen out of his sepulchre; <br><u>Mat_28:16</u>, Christ appears to his disciples, <br><u>Mat_28:18</u>. and sends them to baptize and teach all nations.
Mar 1:	<b>Overview</b><br><u>Mar_1:1</u>, The office of John the Baptist; <br><u>Mar_1:9</u>, Jesus is baptized; <br><u>Mar_1:12</u>, tempted; <br><u>Mar_1:14</u>, he preaches; <br><u>Mar_1:16</u>, calls Peter, Andrew, James, and John; v.23, heals one that had a devil; v.29, Peter's mother in law; v.32, many diseased persons; v.40, and cleanses the leper.
Mar 2:	<b>Overview</b><br><u>Mar_2:1</u>, Christ followed by multitudes, <br><u>Mar_2:3</u>, heals one sick of the palsy; <br><u>Mar_2:13</u>, calls Matthew from the receipt of custom; <br><u>Mar_2:15</u>, eats with Publicans and sinners; <br><u>Mar_2:18</u>, excuses his disciples for not fasting; <br><u>Mar_2:23</u>, and for plucking the ears of corn on the sabbath day.
Mar 3:	<b>Overview</b><br><u>Mar_3:1</u>, Christ heals the withered hand, <br><u>Mar_3:10</u>. and many other infirmities; <br><u>Mar_3:11</u>, rebukes the unclean spirit; <br><u>Mar_3:13</u>, chooses his twelve apostles; <br><u>Mar_3:22</u>, convinces the blasphemy of casting out devils by Beelzebub; <br><u>Mar_3:31</u>, and shows who are his brother, sister, and mother.
Mar 4:	<b>Overview</b><br><u>Mar_4:1</u>, The parable of the sower, <br><u>Mar_4:14</u>. and the meaning thereof; <br><u>Mar_4:21</u>, We must communicate the light of our knowledge to others; <br><u>Mar_4:26</u>, The parable of the seed growing secretly; <br><u>Mar_4:30</u>, and of the mustard seed; <br><u>Mar_4:35</u>, Christ stilleth the tempest on the sea.
Mar 5:	<b>Overview</b><br><u>Mar_5:1</u>, Christ delivering the possessed of the legion of devils, <br><u>Mar_5:13</u>. they enter into the swine; <br><u>Mar_5:22</u>, He is entreated by Jairus to go and heal his daughter; <br><u>Mar_5:25</u>, He heals the woman of the bloody issue, <br><u>Mar_5:35</u>. and raises from death Jairus' daughter.
Mar 6:	<b>Overview</b><br><u>Mar_6:1</u>, Christ is contemned of his countrymen; <br><u>Mar_6:7</u>, He gives the twelve power over unclean spirits; <br><u>Mar_6:14</u>, Divers opinions of Christ; <br><u>Mar_6:16</u>, John the Baptist is imprisoned, beheaded, and buried; <br><u>Mar_6:30</u>, The apostles return from preaching; <br><u>Mar_6:34</u>, The miracle of five loaves and two fishes; <br><u>Mar_6:45</u>, Christ walks on the sea; <br><u>Mar_6:53</u>, and heals all that touch him.
Mar 7:	<b>Overview</b><br><u>Mar_7:1</u>, The Pharisees find fault with the disciples for eating with unwashed hands; <br><u>Mar_7:8</u>, They break the commandment of God by the traditions of men; <br><u>Mar_7:14</u>, Meat defiles not the man; <br><u>Mar_7:24</u>, He heals the Syrophenician woman's daughter of an unclean spirit; <br><u>Mar_7:31</u>, and one that was deaf, and stammered in his speech.
Mar 8:	<b>Overview</b><br><u>Mar_8:1</u>, Christ feeds the people miraculously; <br><u>Mar_8:10</u>, refuses to give a sign to the Pharisees; <br><u>Mar_8:14</u>, admonishes his disciples to beware of the leaven of the Pharisees, and of the leaven of Herod; <br><u>Mar_8:22</u>, gives a blind man his sight; <br><u>Mar_8:27</u>, acknowledges that he is the Christ who should suffer and rise again; <br><u>Mar_8:34</u>, and exhorts to patience in persecution for the profession of the gospel.
Mar 9:	<b>Overview</b><br><u>Mar_9:1</u>, Jesus is transfigured; <br><u>Mar_9:11</u>, He instructs his disciples concerning the coming of Elias; <br><u>Mar_9:14</u>, casts forth a deaf and dumb spirit; <br><u>Mar_9:30</u>, foretells his death and resurrection; <br><u>Mar_9:33</u>, exhorts his disciples to humility; <br><u>Mar_9:38</u>, bidding them not to prohibit such as are not against them, nor to give offence to any of the faithful.
Mar 10:	<b>Overview</b><br><u>Mar_10:1</u>, Christ disputes with the Pharisees touching divorcement: <br><u>Mar_10:13</u>. blesses the children that are brought unto him; <br><u>Mar_10:17</u>, resolves a rich man how he may inherit life everlasting; <br><u>Mar_10:23</u>, tells his disciples of the danger of riches; <br><u>Mar_10:28</u>, promises rewards to them that forsake anything for the gospel; <br><u>Mar_10:32</u>, foretells his death and resurrection; <br><u>Mar_10:35</u>, bids the two ambitious suitors to think rather of suffering with him; <br><u>Mar_10:46</u>, and restores to Bartimaeus his sight.
Mar 11:	<b>Overview</b><br><u>Mar_11:1</u>, Christ rides with triumph into Jerusalem; <br><u>Mar_11:12</u>, curses the fruitless fig-tree; <br><u>Mar_11:15</u>, purges the temple; <br><u>Mar_11:20</u>, exhorts his disciples to stedfastness of faith, and to forgive their enemies; <br><u>Mar_11:27</u>, and defends the lawfulness of his actions by the witness of John, who was a man sent of God.
Mar 12:	<b>Overview</b><br><u>Mar_12:1</u>, In a parable of the vineyard let out to wicked husbandmen Christ foretells the reprobation of the Jews, and the calling of the Gentiles; <br><u>Mar_12:13</u>, He avoids the snare of the Pharisees and Herodians about paying tribute to Caesar; <br><u>Mar_12:18</u>, convicts the Sadducees of error, who denied the resurrection; <br><u>Mar_12:28</u>, resolves the scribe, who questioned of the first commandment; <br><u>Mar_12:35</u>, refutes the opinion that the scribes held of Christ; <br><u>Mar_12:38</u>, bidding the people to beware of their ambition and hypocrisy; <br><u>Mar_12:41</u>, and commends the poor widow for her two mites, above all.
Mar 13:	<b>Overview</b><br><u>Mar_13:1</u>, Christ foretells the destruction of the temple; <br><u>Mar_13:9</u>, the persecutions for the gospel; <br><u>Mar_13:10</u>, that the gospel must be preached to all nations; <br><u>Mar_13:14</u>, that great calamities shall happen to the Jews; <br><u>Mar_13:24</u>, and the manner of his coming to judgment; <br><u>Mar_13:32</u>, the hour whereof being known to none, every man is to watch and pray, that we be not found unprovided, when he comes to each one particularly by death.
Mar 14:	<b>Overview</b><br><u>Mar_14:1</u>, A conspiracy against Christ; <br><u>Mar_14:3</u>, Precious ointment is poured on his head by a woman; <br><u>Mar_14:10</u>, Judas sells his Master for money; <br><u>Mar_14:12</u>, Christ himself foretells how he shall be betrayed by one of his disciples; <br><u>Mar_14:22</u>, after the passover prepared, and eaten, institutes his last supper; <br><u>Mar_14:26</u>, declares aforehand the flight of all his disciples, and Peter's denial; <br><u>Mar_14:43</u>, Judas betrays him with a kiss; <br><u>Mar_14:46</u>, He is apprehended in the garden; <br><u>Mar_14:53</u>, falsely accused and impiously condemned of the Jews' council; <br><u>Mar_14:65</u>, shamefully abused by them; <br><u>Mar_14:66</u>, and thrice denied of Peter.
Mar 15:	<b>Overview</b><br><u>Mar_15:1</u>, Jesus brought bound, and accused before Pilate; <br><u>Mar_15:6</u>, Upon the clamour of the common people, the murderer Barabbas is loosed, and Jesus delivered up to be crucified; <br><u>Mar_15:16</u>, He is crowned with thorns, spit on, and mocked; <br><u>Mar_15:21</u>, faints in bearing his cross; <br><u>Mar_15:27</u>, hangs between two thieves; <br><u>Mar_15:29</u>, suffers the triumphing reproaches of the Jews; <br><u>Mar_15:39</u>, but is confessed by the centurion to be the Son of God; <br><u>Mar_15:42</u>, and is honourably buried by Joseph.
Mar 16:	<b>Overview</b><br><u>Mar_16:1</u>, An Angel declares the resurrection of Christ to three women; <br><u>Mar_16:9</u>, Christ himself appears to Mary Magdalene; <br><u>Mar_16:12</u>, to two going into the country; <br><u>Mar_16:14</u>, then to the apostles; <br><u>Mar_16:15</u>, whom he sends forth to preach the gospel; <br><u>Mar_16:19</u>, and ascends into heaven.
Luk 1:	<b>Overview</b><br><u>Luk_1:1</u>, The preface of Luke to his whole gospel; <br><u>Luk_1:5</u>, The conception of John the Baptist; <br><u>Luk_1:26</u>, and of Christ; <br><u>Luk_1:39</u>, The prophecy of Elisabeth and of Mary, concerning Christ; <br><u>Luk_1:57</u>, The nativity and circumcision of John; <br><u>Luk_1:67</u>, The prophecy of Zacharias, both of Christ, <br><u>Luk_1:76</u>. and of John.
Luk 2:	<b>Overview</b><br><u>Luk_2:1</u>, Augustus taxes all the Roman empire; <br><u>Luk_2:6</u>, The nativity of Christ; <br><u>Luk_2:8</u>, An angel relates it to the shepherds, and many sing praises to God for it; <br><u>Luk_2:15</u>, The shepherds glorify God; <br><u>Luk_2:21</u>, Christ is circumcised; <br><u>Luk_2:22</u>, Mary purified; <br><u>Luk_2:25</u>, Simeon and Anna prophesy of Christ, <br><u>Luk_2:39</u>. who increases in wisdom, <br><u>Luk_2:41</u>. questions in the temple with the doctors, <br><u>Luk_2:51</u>. and is obedient to his parents.
Luk 3:	<b>Overview</b><br><u>Luk_3:1</u>, The preaching and baptism of John; <br><u>Luk_3:15</u>, his testimony of Christ; <br><u>Luk_3:19</u>, Herod imprisons John; <br><u>Luk_3:21</u>, Christ, baptized, receives testimony from heaven; <br><u>Luk_3:23</u>, The age and genealogy of Christ from Joseph upwards.
Luk 4:	<b>Overview</b><br><u>Luk_4:1</u>, The temptation and fasting of Christ; <br><u>Luk_4:14</u>, He begins to preach; <br><u>Luk_4:16</u>, The people of Nazareth admire his gracious words, but being offended, seek to kill him; <br><u>Luk_4:33</u>, He cures one possessed of a devil, <br><u>Luk_4:38</u>. Peter's mother-in-law, <br><u>Luk_4:40</u>. and divers other sick persons; <br><u>Luk_4:41</u>, The devils acknowledge Christ, and are reproved for it; <br><u>Luk_4:42</u>, He preaches through the cities of Galilee.
Luk 5:	<b>Overview</b><br><u>Luk_5:1</u>, Christ teaches the people out of Peter's ship; <br><u>Luk_5:4</u>, in a miraculous taking of fishes, shows how he will make him and his partners fishers of men; <br><u>Luk_5:12</u>, cleanses the leper; <br><u>Luk_5:16</u>, prays in the wilderness; <br><u>Luk_5:17</u>, heals one sick of the palsy; <br><u>Luk_5:27</u>, calls Matthew the Publican; <br><u>Luk_5:29</u>, eats with sinners, as being the physician of souls; <br><u>Luk_5:33</u>, foretells the fastings and afflictions of the apostles after his ascension; <br><u>Luk_5:36</u>, and illustrates the matter by the parable of old bottles and worn garments.
Luk 6:	<b>Overview</b><br><u>Luk_6:1</u>, Christ reproves the Pharisees; <br><u>Luk_6:12</u>, chooses apostles; <br><u>Luk_6:17</u>, heals the diseased; <br><u>Luk_6:20</u>, preaches to his disciples before the people.
