Psa 132:	<b>Overview</b><br><u>Psa_132:1</u>, David in his prayer commends unto God the religious care he had for the ark; <br><u>Psa_132:8</u>, His prayer at the removing of the ark; <br><u>Psa_132:11</u>, with a repetition of God's promises.<br><br>Some attribute this Psalm to Solomon; and others refer it to the building of the second temple; but it seems more probable that it was sung at the solemn induction of the ark into the tabernacle of Mount Zion, expressing the holy joy and triumph of that event. <br><u>Psa_120:1</u>, <br><u>Psa_121:1</u>, <br><u>Psa_122:1</u>, <br><u>Psa_123:1</u>, <br><u>Psa_124:1</u>, <br><u>Psa_125:1</u>, <br><u>Psa_126:1</u>, <br><u>Psa_127:1</u>, <br><u>Psa_128:1</u> *titles <br><u>Psa_129:1</u>, <br><u>Psa_130:1</u>, <br><u>Psa_131:1</u> *titles
Psa 133:	<b>Overview</b><br><u>Psa_133:1</u>, The blessedness of unity among brethren.<br><br>This Psalm was probably composed when David was made king over all Israel. <br><u>Psa_122:1</u>, <br><u>Psa_124:1</u>, <br><u>Psa_131:1</u> *titles
Psa 134:	<b>Overview</b><br><u>Psa_134:1</u>, An exhortation to bless God.<br><br><br><u>Psa_120:1</u>, <br><u>Psa_121:1</u>, <br><u>Psa_122:1</u>, <br><u>Psa_123:1</u>, <br><u>Psa_124:1</u>, <br><u>Psa_125:1</u>, <br><u>Psa_126:1</u>, <br><u>Psa_127:1</u>, <br><u>Psa_128:1</u> *titles <br><u>Psa_129:1</u>, <br><u>Psa_130:1</u>, <br><u>Psa_131:1</u>, <br><u>Psa_132:1</u>, <br><u>Psa_133:1</u> *titles
Psa 135:	<b>Overview</b><br><u>Psa_135:1</u>, An exhortation to praise God for his mercy; <br><u>Psa_135:5</u>, for his power; <br><u>Psa_135:8</u>, for his judgments; <br><u>Psa_135:15</u>, The vanity of idols; <br><u>Psa_135:19</u>, An exhortation to bless God.
Psa 136:	<b>Overview</b><br><u>Psa_136:1</u>, An exhortation to give thanks to God for particular mercies.
Psa 137:	<b>Overview</b><br><u>Psa_137:1</u>, The constancy of the Jews in captivity; <br><u>Psa_137:7</u>, The prophet curses Edom and Babel.
Psa 138:	<b>Overview</b><br><u>Psa_138:1</u>, David praises God for the truth of his word; <br><u>Psa_138:4</u>, He prophesies that the kings of the earth shall praise God; <br><u>Psa_138:7</u>, He professes his confidence in God.<br><br>Five manuscripts omit <i>ledawid;</i> and the LXX and Arabic prefix also the names of Haggai and Zechariah; and it is probable that it was composed to be sung at the dedication of the second temple.
Psa 139:	<b>Overview</b><br><u>Psa_139:1</u>, David praises God for his all-seeing providence; <br><u>Psa_139:17</u>, and for his infinite mercies; <br><u>Psa_139:19</u>, He defies the wicked; <br><u>Psa_139:23</u>, He prays for sincerity.<br><br>This Psalm is supposed to have been composed by David when made king of Israel; though some think it was written by him when accused of traitorous designs against Saul.  It is a most sublime ode on the wisdom, knowledge, presence, and justice of God.  the sentiments are grand, the style highly elevated, and the images various, beautiful, and impressive.
Psa 140:	<b>Overview</b><br><u>Psa_140:1</u>, David prays to be delivered from Saul and Doeg; <br><u>Psa_140:8</u>, He prays against them; <br><u>Psa_140:12</u>, He comforts himself by confidence in God.
Psa 141:	<b>Overview</b><br><u>Psa_141:1</u>, David prays that his suit may be acceptable; <br><u>Psa_141:3</u>, his conscience sincere; <br><u>Psa_141:7</u>, and his life free from snares.
Psa 142:	<b>Overview</b><br><u>Psa_142:1</u>, David shews that in his trouble all his comfort was in prayer unto God.<br><br>Psalm of David giving instruction. <br><u>Psa_32:1</u>, <br><u>Psa_54:1</u>, <br><u>Psa_57:1</u> *titles <br><u>1Ch_4:10</u>
Psa 143:	<b>Overview</b><br><u>Psa_143:1</u>, David prays for favour in judgment; <br><u>Psa_143:3</u>, He complains of his griefs; <br><u>Psa_143:5</u>, He strengthens his faith by meditation and prayer; <br><u>Psa_143:7</u>, He prays for grace; <br><u>Psa_143:9</u>, for deliverance; <br><u>Psa_143:10</u>, for sanctification; <br><u>Psa_143:12</u>, for destruction of his enemies;<br><br> The LXX, Vulgate, Ethiopic, and Arabic state that this Psalm was composed by David on the rebellion of his son Absalom; and there are several passages in it which agree remarkably well with that period; for then he had most reason to fear lest God should deal with him according to his sins; which he deprecates with such a deep sense of his unworthiness, that it has hence been numbered among the penitential Psalms, of which it is the last.  </b><br><br></i><br><br> <b><br><u>Psa_143:1-12</u> </b> <b>David's Type of PrayerReferences </b>   Prays to God for pardon<br><u>Psa_143:1</u>    Acknowledges the impossibility of being saved but by grace<br><u>Psa_143:2</u>    Deplores the lamentable effects of sin<br><u>Psa_143:3</u>, <br><u>Psa_143:4</u>    Comforts himself with a retrospect of God's mercies of old<br><u>Psa_143:5</u>    Prays, in a variety of expressions, for remission of sin, sanctification, and redemption<br><u>Psa_143:6-12</u> 
Psa 144:	<b>Overview</b><br><u>Psa_144:1</u>, David blesses God for his mercy both to him and to man; <br><u>Psa_144:5</u>, He prays that God would powerfully deliver him from his enemies; <br><u>Psa_144:9</u>, He promises to praise God; <br><u>Psa_144:11</u>, He prays for the happy state of the kingdom.<br><br>Calmet and others think that this Psalm was composed by David after the death of Absalom; and from a collation of it with Psa. 18, in which the same ideas and form of expression occur, there can be no doubt of both having proceeded from the same pen, and that David was the author.
Psa 145:	<b>Overview</b><br><u>Psa_145:1</u>, David praises God for his fame; <br><u>Psa_145:8</u>, for his goodness; <br><u>Psa_145:11</u>, for his kingdom; <br><u>Psa_145:14</u>, for his providence; <br><u>Psa_145:17</u>, for his justice, holiness, and saving mercy.<br><br>This incomparable song of praise, which is the last of the acrostic or alphabetical Psalms, each verse beginning with a consecutive letter of the Hebrew alphabet, is supposed to have been composed by David towards the close of his life.
Psa 146:	<b>Overview</b><br><u>Psa_146:1</u>, The Psalmist vows perpetual praises to God; <br><u>Psa_146:3</u>, He exhorts not to trust in man; <br><u>Psa_146:5</u>, God, for his power, justice, mercy, and kingdom, is only worthy to be trusted.
Psa 147:	<b>Overview</b><br><u>Psa_147:1</u>, The prophet exhorts to praise God for his care of the church; <br><u>Psa_147:4</u>, his power and wisdom; <br><u>Psa_147:6</u>, his mercy; <br><u>Psa_147:7</u>, his providence; <br><u>Psa_147:12</u>, to praise him for his blessings upon the kingdom; <br><u>Psa_147:15</u>, for his power over the elements; <br><u>Psa_147:19</u>, and for his ordinances in the church.
Psa 148:	<b>Overview</b><br><u>Psa_148:1</u>, The psalmist exhorts the celestial, <br><u>Psa_148:7</u>, the terrestrial, <br><u>Psa_148:11</u>, and the rational creatures to praise God.
Psa 149:	<b>Overview</b><br><u>Psa_149:1</u>, The prophet exhorts to praise God for his love to the church; <br><u>Psa_149:5</u>, and for that power which he has given to the church.
Psa 150:	<b>Overview</b><br><u>Psa_150:1</u>, An exhortation to praise God; <br><u>Psa_150:3</u>, with all kinds of instruments.
Pro 1:	<b>Overview</b><br><u>Pro_1:1</u>, The use of the proverbs; <br><u>Pro_1:7</u>, An exhortation to fear God, and believe his word; <br><u>Pro_1:10</u>, to avoid the enticings of sinners; <br><u>Pro_1:20</u>, Wisdom complains of her contempt; <br><u>Pro_1:24</u>, She threatens her contemners.
Pro 2:	<b>Overview</b><br><u>Pro_2:1</u>, Wisdom promises godliness to her children; <br><u>Pro_2:10</u>, and safety from evil company; <br><u>Pro_2:20</u>, and direction in good ways.
Pro 3:	<b>Overview</b><br><u>Pro_3:1</u>, Sundry exhortations; <br><u>Pro_3:13</u>, The gain of wisdom; <br><u>Pro_3:27</u>, Exhortation to beneficence, etc; <br><u>Pro_3:33</u>, The different state of the wicked and upright.
Pro 4:	<b>Overview</b><br><u>Pro_4:1</u>, Solomon persuades to wisdom, <br><u>Pro_4:14</u>, and to shun wickedness; <br><u>Pro_4:20</u>, He exhorts to sanctification.
Pro 5:	<b>Overview</b><br><u>Pro_5:1</u>, Solomon exhorts to wisdom; <br><u>Pro_5:3</u>, He shews the mischief of whoredom and riot; <br><u>Pro_5:15</u>, He exhorts to contentedness, liberality, and chastity; <br><u>Pro_5:22</u>, The wicked are overtaken with their own sins.
Pro 6:	<b>Overview</b><br><u>Pro_6:1</u>, Against suretyship; <br><u>Pro_6:6</u>, idleness; <br><u>Pro_6:12</u>, and mischievousness; <br><u>Pro_6:16</u>, Seven things hateful to God; <br><u>Pro_6:20</u>, The blessings of obedience; <br><u>Pro_6:25</u>, The mischiefs of whoredom.
Pro 7:	<b>Overview</b><br><u>Pro_7:1</u>, Solomon persuades to a sincere and kind familiarity with wisdom; <br><u>Pro_7:6</u>, In an example of his own experience, he shews, <br><u>Pro_7:10</u>, the cunning of a harlot; <br><u>Pro_7:22</u>, and the desperate simplicity of a young wanton; <br><u>Pro_7:24</u>, He dehorteth from such wickedness.
Pro 8:	<b>Overview</b><br><u>Pro_8:1</u>, The fame, <br><u>Pro_8:6</u>, and evidence of wisdom; <br><u>Pro_8:10</u>, The excellency, <br><u>Pro_8:12</u>, the nature, <br><u>Pro_8:15</u>, the power, <br><u>Pro_8:18</u>, the riches, <br><u>Pro_8:22</u>, and the eternity of wisdom; <br><u>Pro_8:32</u>, Wisdom is to be desired for the blessedness it brings.
Pro 9:	<b>Overview</b><br><u>Pro_9:1</u>, The discipline, <br><u>Pro_9:4</u>, and doctrine of wisdom; <br><u>Pro_9:13</u>, The custom, <br><u>Pro_9:16</u>, and error of folly.
Pro 10:	<b>Overview</b><br><u>Pro_10:1</u>, From this chapter to the <br><u>Pro_5:1</u> and <br><u>Pro_20:1</u> are sundry observations of moral virtues, and their contrary vices.
Pro 25:	<b>Overview</b><br><u>Pro_25:1</u>, Observations about kings, <br><u>Pro_25:8</u>, and about avoiding causes of quarrels, and sundry causes thereof.
Pro 26:	<b>Overview</b><br><u>Pro_26:1</u>, Observations about fools; <br><u>Pro_26:13</u>, about sluggards; <br><u>Pro_26:17</u>, and about contentious busy-bodies.
Pro 27:	<b>Overview</b><br><u>Pro_27:1</u>, Observations of self love; <br><u>Pro_27:5</u>, of true love; <br><u>Pro_27:11</u>, of care to avoid offenses; <br><u>Pro_27:23</u>, and of the household care.
Pro 28:	<b>Overview</b><br><u>Pro_28:1</u>, General observations of impiety and religious integrity.
Pro 29:	<b>Overview</b><br><u>Pro_29:1</u>, Observations of public government, <br><u>Pro_29:15</u>, and of private; <br><u>Pro_29:22</u>, Of anger, pride, thievery, cowardice, and corruption.
Pro 30:	<b>Overview</b><br><u>Pro_30:1</u>, Agur's confession of his faith; <br><u>Pro_30:7</u>, The two points of his prayer; <br><u>Pro_30:10</u>, The meanest are not to be wronged; <br><u>Pro_30:11</u>, Four wicked generations; <br><u>Pro_30:15</u>, Four things insatiable; <br><u>Pro_30:17</u>, Parents are not to be despised; <br><u>Pro_30:18</u>, Four things hard to be known; <br><u>Pro_30:21</u>, Four things intolerable; <br><u>Pro_30:24</u>, Four things exceeding wise; <br><u>Pro_30:29</u>, Four things stately; <br><u>Pro_30:32</u>, Wrath is to be prevented.
Pro 31:	<b>Overview</b><br><u>Pro_31:1</u>, Lemuel's lesson of chastity and temperance; <br><u>Pro_31:6</u>, The afflicted are to be comforted and defended; <br><u>Pro_31:10</u>, The praise and properties of a good wife.
Ecc 1:	</b><br><u>Ecc_1:1</u>, The preacher shews that all human courses are vain; <br><u>Ecc_1:4</u>, because the creatures are restless in their courses, <br><u>Ecc_1:9</u>, they bring forth nothing new, and all old things are forgotten; <br><u>Ecc_1:12</u>, and because he has found it so in the studies of wisdom.
Ecc 2:	<b>Overview</b><br><u>Ecc_2:1</u>, The vanity of human courses in the works of pleasure; <br><u>Ecc_2:12</u>, Though the wise be better than the fool, yet both have one event; <br><u>Ecc_2:18</u>, The vanity of human labour, in leaving it they know not to whom; <br><u>Ecc_2:24</u>, Nothing better than joy in our labour; but that is God's gift.
Ecc 3:	<b>Overview</b><br><u>Ecc_3:1</u>, By the necessary change of times, vanity is added to human travail; <br><u>Ecc_3:11</u>, There is an excellency in God's works; <br><u>Ecc_3:16</u>, But as for man, God shall judge his works hereafter, though here he be like a beast.
Ecc 4:	<b>Overview</b><br><u>Ecc_4:1</u>, Vanity is increased unto men by oppression; <br><u>Ecc_4:4</u>, by envy; <br><u>Ecc_4:5</u>, by idleness; <br><u>Ecc_4:7</u>, by covetousness; <br><u>Ecc_4:9</u>, by solitariness; <br><u>Ecc_4:13</u>, by wilfulness.
Ecc 5:	<b>Overview</b><br><u>Ecc_5:1</u>, Vanities in divine service; <br><u>Ecc_5:8</u>, in murmuring against oppression; <br><u>Ecc_5:9</u>, and in riches; <br><u>Ecc_5:18</u>, Joy in riches is the gift of God.
Ecc 6:	<b>Overview</b><br><u>Ecc_6:1</u>, The vanity of riches without use; <br><u>Ecc_6:3</u>, though a man have many children and a long life; <br><u>Ecc_6:7</u>, The vanity of sight and wandering desires; <br><u>Ecc_6:10</u>, The conclusion of vanities.
Ecc 7:	<b>Overview</b><br><u>Ecc_7:1</u>, Remedies against vanity are, a good name; <br><u>Ecc_7:2</u>, mortification; <br><u>Ecc_7:7</u>, patience; <br><u>Ecc_7:11</u>, wisdom; <br><u>Ecc_7:23</u>, The difficulty of wisdom.
Ecc 8:	<b>Overview</b><br><u>Ecc_8:1</u>, True wisdom is modest; <br><u>Ecc_8:2</u>, Kings are to be respected; <br><u>Ecc_8:6</u>, Divine providence is to be observed; <br><u>Ecc_8:12</u>, It is better with the godly in adversity, than with the wicked in prosperity; <br><u>Ecc_8:16</u>, The work of God is unsearchable.
Ecc 9:	<b>Overview</b><br><u>Ecc_9:1</u>, Like things happen to good and bad; <br><u>Ecc_9:4</u>, There is a necessity of death unto men; <br><u>Ecc_9:7</u>, Comfort is all their portion in this life; <br><u>Ecc_9:11</u>, God's providence rules over all; <br><u>Ecc_9:13</u>, Wisdom is better than strength.
Ecc 10:	<b>Overview</b><br><u>Ecc_10:1</u>, Observations of wisdom and folly; <br><u>Ecc_10:16</u>, of riot; <br><u>Ecc_10:18</u>, slothfulness; <br><u>Ecc_10:19</u>, and money; <br><u>Ecc_10:20</u>, Men's thoughts of kings ought to be reverent.
Ecc 11:	<b>Overview</b><br><u>Ecc_11:1</u>, Directions for charity; <br><u>Ecc_11:7</u>, Death in life, <br><u>Ecc_11:9</u>, and the day ofjudgment in the days of youth, are to be thought on.
Ecc 12:	<b>Overview</b><br><u>Ecc_12:1</u>, The Creator is to be remembered in due time; <br><u>Ecc_12:8</u>, The preacher's care to edify; <br><u>Ecc_12:13</u>, The fear of God is the chief antidote of vanity.
Son 1:	</b><br><u>Son_1:1</u>, The church's love unto Christ; <br><u>Son_1:5</u>, She confesses her deformity, <br><u>Son_1:7</u>, and prays to be directed to his flock; <br><u>Son_1:8</u>, Christ directs her to the shepherd's tents; <br><u>Son_1:9</u>, and shewing his love to her, <br><u>Son_1:11</u>, gives her gracious promises; <br><u>Son_1:12</u>, The church and Christ congratulate one another.
Son 2:	<b>Overview</b><br><u>Son_2:1</u>, The mutual love of Christ and his church; <br><u>Son_2:8</u>, The hope, <br><u>Son_2:10</u>, and calling of the church; <br><u>Son_2:14</u>, Christ's care of the church; <br><u>Son_2:16</u>, The profession of the church, her faith, and hope.
Son 3:	<b>Overview</b><br><u>Son_3:1</u>, The church's fight and victory in temptation; <br><u>Son_3:6</u>, The church glories in Christ.
Son 4:	<b>Overview</b><br><u>Son_4:1</u>, Christ sets forth the graces of the church; <br><u>Son_4:8</u>, He shews his love to her; <br><u>Son_4:16</u>, The church prays to be made fit for his presence.
Son 5:	<b>Overview</b><br><u>Son_5:1</u>, Christ awakes the church with his calling; <br><u>Son_5:2</u>, The church having a taste of Christ's love, is sick of love; <br><u>Son_5:9</u>, A description of Christ by his graces.
Son 6:	<b>Overview</b><br><u>Son_6:1</u>, The church professes her faith in Christ; <br><u>Son_6:4</u>, Christ shews the graces of the church; <br><u>Son_6:10</u>, and his love towards her.
Son 7:	<b>Overview</b><br><u>Son_7:1</u>, A further description of the church's graces; <br><u>Son_7:10</u>, The church professes her faith and desire.
Son 8:	<b>Overview</b><br><u>Son_8:1</u>, The love of the church to Christ; <br><u>Son_8:6</u>, The vehemency of love; <br><u>Son_8:8</u>, The calling of the Gentiles; <br><u>Son_8:14</u>, The church prays for Christ's coming.
Isa 1:	<b>Overview</b><br><u>Isa_1:1</u>, Isaiah complains of Judah for her rebellion; <br><u>Isa_1:5</u>, He laments her judgments; <br><u>Isa_1:10</u>, He upbraids their whole service; <br><u>Isa_1:16</u>, He exhorts to repentance, with promises and threatenings; <br><u>Isa_1:21</u>, Bewailing their wickedness, he denounces God's judgments; <br><u>Isa_1:25</u>, He promises grace; <br><u>Isa_1:28</u>, and threatens destruction to the wicked.
Isa 2:	<b>Overview</b><br><u>Isa_2:1</u>, Isaiah prophesies the coming of Christ's kingdom; <br><u>Isa_2:6</u>, Wickedness is the cause of God's forsaking; <br><u>Isa_2:10</u>, He exhorts to fear, because of the powerful effects of God's majesty.
Isa 3:	<b>Overview</b><br><u>Isa_3:1</u>, The great calamities which come by sin; <br><u>Isa_3:10</u>, The different reward of the righteous and wicked; <br><u>Isa_3:12</u>, The oppression and covetousness of the rulers; <br><u>Isa_3:16</u>, The judgments which shall be for the pride of the women; <br><u>Isa_3:25</u>, The general desolation.
Isa 4:	<b>Overview</b><br><u>Isa_4:1</u>, In the extremity of evils, Christ's kingdom shall be a sanctuary.
Isa 5:	<b>Overview</b><br><u>Isa_5:1</u>, Under the parable of a vineyard, God excuses his severe judgment; <br><u>Isa_5:8</u>, His judgments upon covetousness; <br><u>Isa_5:11</u>, upon lasciviousness; <br><u>Isa_5:13</u>, upon impiety; <br><u>Isa_5:20</u>, and upon injustice; <br><u>Isa_5:26</u>, the executioners of God's judgments.
Isa 6:	<b>Overview</b><br><u>Isa_6:1</u>, Isaiah, in a vision of the Lord in his glory, <br><u>Isa_6:5</u>, being terrified, has apprehensions removed; <br><u>Isa_6:8</u>, He offers himself, and is sent to shew the obstinacy of the people unto their desolation; <br><u>Isa_6:13</u>, A remnant shall be saved.
Isa 7:	<b>Overview</b><br><u>Isa_7:1</u>, Ahaz, being troubled with fear of Rezin and Pekah, is comforted by Isaiah; <br><u>Isa_7:10</u>, Ahaz, having liberty to choose a sign, and refusing it, hath for a sign, Christ promised; <br><u>Isa_7:17</u>, His judgment is prophesied to come by Assyria.
Isa 8:	<b>Overview</b><br><u>Isa_8:1</u>, In Maher-shalal-hash-baz, he prophesies that Syria and Israel shall be subdued by Assyria; <br><u>Isa_8:5</u>, Judah likewise for their infidelity; <br><u>Isa_8:9</u>, God's judgments shall be irresistible; <br><u>Isa_8:11</u>, Comfort shall be to them that fear God; <br><u>Isa_8:19</u>, Great afflictions to idolaters.
Isa 9:	<b>Overview</b><br><u>Isa_9:1</u>, What joy shall be in the midst of afflictions, by the birth and kingdom of Christ; <br><u>Isa_9:8</u>, The judgments upon Israel for their pride, <br><u>Isa_9:13</u>. for their hypocrisy, <br><u>Isa_9:18</u>. and for their impenitency.
Isa 10:	<b>Overview</b><br><u>Isa_10:1</u>, The woe of tyrants; <br><u>Isa_10:5</u>, Assyria, the rod of hypocrites, for his pride shall be broken; <br><u>Isa_10:20</u>, A remnant of Israel shall be saved; <br><u>Isa_10:24</u>, Judah is comforted with promise of deliverance from Assyria.
Isa 11:	<b>Overview</b><br><u>Isa_11:1</u>, The peaceable kingdom of the Branch out of the root of Jesse; <br><u>Isa_11:10</u>, The victorious restoration of Israel, and vocation of the Gentiles.
Isa 12:	<b>Overview</b><br><u>Isa_12:1</u>, A joyful thanksgiving of the faithful for the mercies of God.
Isa 13:	<b>Overview</b><br><u>Isa_13:1</u>, God musters the armies of his wrath; <br><u>Isa_13:6</u>, He threatens to destroy Babylon by the Medes; <br><u>Isa_13:19</u>, The desolation of Babylon.
Isa 14:	<b>Overview</b><br><u>Isa_14:1</u>, God's merciful restoration of Israel; <br><u>Isa_14:3</u>, Their triumphant exultation over Babel; <br><u>Isa_14:24</u>, God's purpose against Assyria; <br><u>Isa_14:29</u>, Palestina is threatened.
Isa 15:	<b>Overview</b><br><u>Isa_15:1</u>, The lamentable state of Moab.
Isa 16:	<b>Overview</b><br><u>Isa_16:1</u>, Moab is exhorted to yield obedience to the throne of David; <br><u>Isa_16:6</u>, Moab is threatened for her pride; <br><u>Isa_16:9</u>, The prophet bewails her; <br><u>Isa_16:12</u>, The judgment of Moab.
Isa 17:	<b>Overview</b><br><u>Isa_17:1</u>, Syria and Israel are threatened; <br><u>Isa_17:6</u>, A remnant shall forsake idolatry; <br><u>Isa_17:9</u>, The rest shall be plagued for their impiety; <br><u>Isa_17:12</u>, The woe of Israel's enemies.
Isa 18:	<b>Overview</b><br><u>Isa_18:1</u>, God, in care of his people, will destroy the Ethiopians; <br><u>Isa_18:7</u>, An accession thereby shall be made to the church.
Isa 19:	<b>Overview</b><br><u>Isa_19:1</u>, The confusion of Egypt; <br><u>Isa_19:11</u>, The foolishness of their princes; <br><u>Isa_19:18</u>, The calling of Egypt into the church; <br><u>Isa_19:23</u>, The covenant of Egypt, Assyria, and Israel.
Isa 20:	<b>Overview</b><br><u>Isa_20:1</u>, A type prefiguring the shameful captivity of Egypt and Ethiopia.
Isa 21:	<b>Overview</b><br><u>Isa_21:1</u>, The prophet, bewailing the captivity of his people, sees in a vision the fall of Babylon by the Medes and Persians; <br><u>Isa_21:11</u>, Edom, scorning the prophet, is moved to repentance; <br><u>Isa_21:13</u>, The set time of Arabia's calamity.
Isa 22:	<b>Overview</b><br><u>Isa_22:1</u>, The prophet laments the invasion of Jewry; <br><u>Isa_22:8</u>, He reproves their human wisdom and worldly joy; <br><u>Isa_22:15</u>, He prophesies Shebna's deprivation, <br><u>Isa_22:20</u>. and the substitution of Eliakim, prefiguring the kingdom of Christ.
Isa 23:	<b>Overview</b><br><u>Isa_23:1</u>, The miserable overthrow of Tyre; <br><u>Isa_23:15</u>, Her restoration and whoredoms.
Isa 24:	<b>Overview</b><br><u>Isa_24:1</u>, The doleful judgments of God upon the land; <br><u>Isa_24:13</u>, A remnant shall joyfully praise him; <br><u>Isa_24:16</u>, God in his judgments shall advance his kingdom.
Isa 28:	<b>Overview</b><br><u>Isa_28:1</u>, The prophet threatens Ephraim for their pride and drunkenness; <br><u>Isa_28:5</u>, The residue shall be advanced in the kingdom of Christ; <br><u>Isa_28:7</u>, He rebukes their error; <br><u>Isa_28:9</u>, their untowardness to learn; <br><u>Isa_28:14</u>, and their security; <br><u>Isa_28:16</u>, Christ the sure foundation is promised; <br><u>Isa_28:17</u>, Their security shall be tried; <br><u>Isa_28:23</u>, They are incited to the consideration of God's discreet providence.
Isa 29:	<b>Overview</b><br><u>Isa_29:1</u>, God's heavy judgment upon Jerusalem; <br><u>Isa_29:7</u>, The unsatiableness of her enemies; <br><u>Isa_29:9</u>, The senselessness, <br><u>Isa_29:13</u>. and deep hypocrisy of the Jews; <br><u>Isa_29:17</u>, A promise of sanctification to the godly.
Isa 30:	<b>Overview</b><br><u>Isa_30:1</u>, The prophet threatens the people for their confidence in Egypt, <br><u>Isa_30:8</u>, and contempt of God's word; <br><u>Isa_30:18</u>, God's mercies towards his church; <br><u>Isa_30:27</u>, God's wrath and the people's joy, in the destruction of Assyria.
Isa 31:	<b>Overview</b><br><u>Isa_31:1</u>, The prophet shews the folly and danger of trusting to Egypt, and forsaking God; <br><u>Isa_31:6</u>, He exhorts to conversion; <br><u>Isa_31:8</u>, He shews the fall of Assyria.
Isa 32:	<b>Overview</b><br><u>Isa_32:1</u>, The blessings of Christ's kingdom; <br><u>Isa_32:9</u>, Desolation is foreshewn; <br><u>Isa_32:15</u>, Restoration is promised to succeed.
Isa 33:	<b>Overview</b><br><u>Isa_33:1</u>, God's judgments against the enemies of the church; <br><u>Isa_33:13</u>, The consternation of sinners, and privileges of the godly.
Isa 34:	<b>Overview</b><br><u>Isa_34:1</u>, The judgments wherewith God revenges his church; <br><u>Isa_34:11</u>, The desolation of her enemies; <br><u>Isa_34:16</u>, The certainty of the prophecy.
Isa 35:	<b>Overview</b><br><u>Isa_35:1</u>, The joyful flourishing of Christ's kingdom; <br><u>Isa_35:3</u>, The weak are encouraged by the virtues and privileges of the Gospel.
Isa 36:	<b>Overview</b><br><u>Isa_36:1</u>, Sennacherib invades Judah; <br><u>Isa_36:2</u>, Rabshakeh, sent by Sennacherib, by blasphemous persuasions solicits the people to revolt; <br><u>Isa_36:22</u>, His words are told to Hezekiah.
Isa 37:	<b>Overview</b><br><u>Isa_37:1</u>, Hezekiah mourning, sends to Isaiah to pray for them; <br><u>Isa_37:6</u>, Isaiah comforts them; <br><u>Isa_37:8</u>, Sennacherib, going to encounter Tirhakah, sends a blasphemous letter to Hezekiah; <br><u>Isa_37:14</u>, Hezekiah's prayer; <br><u>Isa_37:21</u>, Isaiah's prophecy of the pride and destruction of Sennacherib, and the good of Zion; <br><u>Isa_37:36</u>, An angel slays the Assyrians; <br><u>Isa_37:37</u>, Sennacherib is slain at Nineveh by his own sons.
Isa 38:	<b>Overview</b><br><u>Isa_38:1</u>, Hezekiah, having received a message of death, by prayer has his life lengthened; <br><u>Isa_38:8</u>, The sun goes ten degrees backward, for a sign of that promise; <br><u>Isa_38:9</u>, His song of thanksgiving.
Isa 39:	<b>Overview</b><br><u>Isa_39:1</u>, Merodach-baladan, sending to visit Hezekiah because of the wonder, has notice of his treasures; <br><u>Isa_39:3</u>, Isaiah, understanding thereof, foretells the Babylonian captivity.
Isa 40:	<b>Overview</b><br><u>Isa_40:1</u>, The promulgation of the Gospel; <br><u>Isa_40:3</u>, The preaching of John Baptist; <br><u>Isa_40:9</u>, The preaching of the apostles; <br><u>Isa_40:12</u>, The prophet, by the omnipotency of God, <br><u>Isa_40:18</u>. and his incomparableness, <br><u>Isa_40:26</u>. comforts the people.
